{
  "totalRecords": 170,
  "meta": {
    "generatedAt": "2024-07-30T12:30:00Z"
  },
  "riskWiseZoneDistribution": {
    "description": "Distribution of issues across Zero Tolerance, High, Medium, and Low risk levels for each zone. Percentages are relative to each zone's total issues.",
    "zones": [
      {
        "zoneName": "South Zone",
        "totalIssues": 50,
        "riskBreakdown": [
          {
            "riskLevel": "Zero Tolerance",
            "count": 7,
            "percent": 14
          },
          {
            "riskLevel": "High",
            "count": 20,
            "percent": 40
          },
          {
            "riskLevel": "Medium",
            "count": 15,
            "percent": 30
          },
          {
            "riskLevel": "Low",
            "count": 8,
            "percent": 16
          }
        ]
      },
      {
        "zoneName": "East Zone",
        "totalIssues": 45,
        "riskBreakdown": [
          {
            "riskLevel": "Zero Tolerance",
            "count": 5,
            "percent": 11.1
          },
          {
            "riskLevel": "High",
            "count": 18,
            "percent": 40
          },
          {
            "riskLevel": "Medium",
            "count": 14,
            "percent": 31.1
          },
          {
            "riskLevel": "Low",
            "count": 8,
            "percent": 17.8
          }
        ]
      },
      {
        "zoneName": "North Zone",
        "totalIssues": 40,
        "riskBreakdown": [
          {
            "riskLevel": "Zero Tolerance",
            "count": 3,
            "percent": 7.5
          },
          {
            "riskLevel": "High",
            "count": 12,
            "percent": 30
          },
          {
            "riskLevel": "Medium",
            "count": 15,
            "percent": 37.5
          },
          {
            "riskLevel": "Low",
            "count": 10,
            "percent": 25
          }
        ]
      },
      {
        "zoneName": "West Zone",
        "totalIssues": 35,
        "riskBreakdown": [
          {
            "riskLevel": "Zero Tolerance",
            "count": 2,
            "percent": 5.7
          },
          {
            "riskLevel": "High",
            "count": 8,
            "percent": 22.9
          },
          {
            "riskLevel": "Medium",
            "count": 15,
            "percent": 42.9
          },
          {
            "riskLevel": "Low",
            "count": 10,
            "percent": 28.6
          }
        ]
      }
    ]
  },
  "auditeesHighRiskConcentration": {
    "description": "Top 3 auditees ranked by combined High and Zero Tolerance issue count, with individual breakdowns and contribution to total critical issues.",
    "totalCriticalIssues": 75,
    "top3": [
      {
        "auditeeName": "Alpha Corp – Mumbai",
        "highRiskCount": 15,
        "zeroToleranceCount": 5,
        "totalCriticalCount": 20,
        "contributionPercent": 26.67
      },
      {
        "auditeeName": "Beta Solutions – Delhi",
        "highRiskCount": 12,
        "zeroToleranceCount": 4,
        "totalCriticalCount": 16,
        "contributionPercent": 21.33
      },
      {
        "auditeeName": "Gamma Ltd – Kolkata",
        "highRiskCount": 10,
        "zeroToleranceCount": 3,
        "totalCriticalCount": 13,
        "contributionPercent": 17.33
      }
    ]
  },
  "recurringCriticalByZone": {
    "description": "For each zone, count and percentage of High and Zero Tolerance issues that are flagged as recurring. Sorted by recurringCriticalPercent descending.",
    "zones": [
      {
        "zoneName": "South Zone",
        "totalCriticalIssues": 27,
        "recurringCriticalCount": 12,
        "recurringCriticalPercent": 44.44
      },
      {
        "zoneName": "East Zone",
        "totalCriticalIssues": 23,
        "recurringCriticalCount": 10,
        "recurringCriticalPercent": 43.48
      },
      {
        "zoneName": "North Zone",
        "totalCriticalIssues": 15,
        "recurringCriticalCount": 6,
        "recurringCriticalPercent": 40
      },
      {
        "zoneName": "West Zone",
        "totalCriticalIssues": 10,
        "recurringCriticalCount": 4,
        "recurringCriticalPercent": 40
      }
    ]
  },
  "recurringCriticalByGroup": {
    "description": "Top 3 groups by count of High and Zero Tolerance issues that are also recurring, sorted by recurringCriticalCount descending.",
    "totalRecurringCriticalIssues": 32,
    "top3": [
      {
        "groupName": "Compliance Dept",
        "totalCriticalIssues": 20,
        "recurringCriticalCount": 10,
        "recurringCriticalPercent": 50
      },
      {
        "groupName": "Risk Management",
        "totalCriticalIssues": 18,
        "recurringCriticalCount": 8,
        "recurringCriticalPercent": 44.44
      },
      {
        "groupName": "Operations Team",
        "totalCriticalIssues": 15,
        "recurringCriticalCount": 8,
        "recurringCriticalPercent": 53.33
      }
    ]
  }
}